{"schemaVersion":"1","decisionId":"decision-allow-001","decision":"ALLOW","contractId":"urn:datacontract:orders","effectiveDate":"2026-08-20","breaking":false,"requiredVersionBump":"none","reasonCodes":[],"reasons":[],"changes":[],"validation":{"valid":true,"issueCodes":[],"issues":[]},"policy":{"valid":true,"idViolation":false,"versionViolation":false,"retiredViolation":false},"evidence":{"hasChanges":false,"mergeConflictsCount":0}}
