{"schemaVersion":"1","decisionId":"decision-block-001","decision":"BLOCK","contractId":"urn:datacontract:orders","effectiveDate":"2026-08-20","breaking":true,"requiredVersionBump":"major","reasonCodes":["PROPERTY_REMOVED"],"reasons":[{"code":"PROPERTY_REMOVED","severity":"WARNING","path":"schema[orders].properties[legacy_id]","message":"Property was removed."}],"changes":[{"changeType":"REMOVE","entityType":"PROPERTY","identity":["orders","legacy_id"],"path":"schema[orders].properties[legacy_id]","field":null,"before":{"logicalType":"string","name":"legacy_id"},"after":null,"domain":"STRUCTURE","breaking":true,"reasonCodes":["PROPERTY_REMOVED"],"evidence":[]}],"validation":{"valid":true,"issueCodes":[],"issues":[]},"policy":{"valid":false,"idViolation":false,"versionViolation":false,"retiredViolation":false},"evidence":{"hasChanges":true,"mergeConflictsCount":0}}
